disease,question,answer
Brownspot ,What economic impact does this disease have on farmers?,Economic losses include reduced income and increased costs.
Brownspot ,How does this disease affect the nutritional value of crops?,Nutritional value may decrease due to poor grain quality.
Brownspot ,Are there visible differences in affected and unaffected crops?,Affected crops are visibly weaker and discolored.
Brownspot ,How does this disease impact the market value of rice?,Market value drops due to lower grain quality.
Brownspot ,Does this disease lead to uneven growth in rice fields?,Uneven growth patterns are common in infected fields.
Brownspot ,What are the long-term impacts on fields with frequent disease outbreaks?,Frequent outbreaks lead to soil depletion and reduced productivity.
Brownspot ,How does this disease interact with other stress factors on plants?,Stress factors like drought exacerbate the disease's impact.
Brownspot ,Is the loss caused by this disease uniform across all rice varieties?,Yield losses vary by variety and resistance levels.
Brownspot ,What role does early detection play in reducing yield loss?,Early detection minimizes yield losses significantly.
Brownspot ,How does this disease affect the milling quality of rice grains?,Milling quality is reduced due to discolored grains.
Brownspot ,Can this disease lead to replanting costs for farmers?,Farmers may incur replanting costs if crops are destroyed.
Brownspot ,Does this disease always lead to yield losses?,Minor infections may not lead to yield losses.
Brownspot ,What is the average yield loss caused by this disease worldwide?,Worldwide yield losses average 10-15%.
Brownspot ,Are organic farms more or less affected by this disease?,Organic farms may experience fewer outbreaks due to healthier practices.
Brownspot ,How does the disease affect grain size and weight?,Grain size and weight decrease with severe infection.
Brownspot ,Are infected crops more likely to attract pests?,Infected crops may attract secondary pests.
Brownspot ,Does this disease reduce the nutritional value of the rice produced?,Nutritional value reduces in severely infected grains.
Brownspot ,How does this disease affect the appearance of rice grains?,Grains appear discolored and shriveled.
Brownspot ,Are there studies quantifying the economic impact of this disease?,Studies estimate billions in losses globally due to brown spot.
Brownspot ,How much time does it take for yield losses to become noticeable?,Symptoms become noticeable within weeks of infection.
Brownspot ,Are there indirect impacts on productivity caused by this disease?,Indirect impacts include higher management costs.
Brownspot ,Can infected plants still produce viable seeds?,Some infected plants may produce viable seeds.
Brownspot ,How does this disease affect overall field uniformity?,Affected fields show uneven plant vigor.
Brownspot ,What percentage of the field is typically affected in severe cases?,Severe cases can affect over 50% of a field.
Brownspot ,Are yield losses from this disease consistent across regions?,Losses vary based on region and climate.
Brownspot ,How does delayed treatment increase yield losses?,Delayed treatment results in compounding losses.
Brownspot ,Can modern farming technology mitigate yield losses?,Technology like precision spraying can reduce losses.
Brownspot ,Are there long-term soil effects from this disease?,Long-term soil effects include nutrient depletion.
Brownspot ,Can this disease cause farmers to abandon fields entirely?,Farmers may abandon fields after repeated outbreaks.
Brownspot ,Are export-quality rice grains impacted more by this disease?,Export-quality grains are heavily impacted by discoloration.
Brownspot ,How does this disease affect farmer incomes directly?,Income decreases due to lower marketable yield.
Brownspot ,How can this disease be prevented?,Prevention includes crop rotation and resistant varieties.
Brownspot ,What are effective prevention strategies for this disease?,Strategies include proper water management and sanitation.
Brownspot ,What can farmers do to reduce the risk of this disease?,Farmers should use certified seeds and balanced fertilization.
Brownspot ,How should fields be prepared to prevent this disease?,Fields should be plowed and sanitized to remove residues.
Brownspot ,What preventive measures can be taken during the planting season?,Avoid planting infected seeds during planting season.
Brownspot ,Are there any resistant varieties to this disease?,Resistant varieties reduce infection rates.
Brownspot ,What role does crop rotation play in preventing this disease?,Crop rotation breaks the disease cycle.
Brownspot ,How does water management help prevent this disease?,Proper drainage prevents waterlogging and spore germination.
Brownspot ,Can the use of fertilizers prevent this disease?,Fertilizer balance strengthens plant resistance.
Brownspot ,What role does field sanitation play in disease prevention?,Field sanitation eliminates fungal sources.
Brownspot ,Should farmers remove infected plants to prevent spread?,Infected plants should be removed to prevent spread.
Brownspot ,Are there any biological controls for this disease?,Biological controls like fungal antagonists are effective.
Brownspot ,How does avoiding overcrowding help prevent this disease?,Avoid overcrowding to ensure good air circulation.
Brownspot ,What should farmers avoid doing to prevent this disease?,Avoid over-irrigation to reduce humidity.
Brownspot ,Can monitoring weather forecasts help in disease prevention?,Weather forecasts can guide preventive measures.
Brownspot ,Are there specific tools for detecting this disease early?,Tools like remote sensing detect symptoms early.
Brownspot ,How do seed treatments help prevent this disease?,Seed treatments reduce initial infections.
Brownspot ,What role does pest control play in preventing this disease?,Pest control prevents vector spread.
Brownspot ,Are there government recommendations for disease prevention?,Government policies guide prevention techniques.
Brownspot ,How does maintaining healthy soil help avoid this disease?,Healthy soils support plant immunity.
Brownspot ,What advanced techniques are available to prevent this disease?,Advanced techniques include predictive modeling.
Brownspot ,Can using specific fertilizers reduce the risk of this disease?,"Some fertilizers, like silicon, improve plant defenses."
Brownspot ,How does proper drainage help prevent this disease?,Proper drainage reduces the risk of fungal buildup.
Brownspot ,Are there natural ways to prevent this disease without chemicals?,Natural methods like organic mulching help.
Brownspot ,Does planting resistant rice varieties guarantee prevention?,Resistant varieties minimize but do not guarantee prevention.
Brownspot ,Can weather prediction tools help in disease prevention?,Weather prediction tools aid in timing preventive actions.
Brownspot ,How often should fields be inspected to prevent this disease?,Fields should be inspected weekly for signs.
Brownspot ,Are there community-level prevention strategies for this disease?,Community-level measures include shared disease alerts.
Brownspot ,Can crop diversification help in prevention efforts?,Crop diversification reduces disease pressure.
Brownspot ,How does seed quality testing help in prevention?,Seed testing ensures planting quality.
Brownspot ,Are there apps or tools for monitoring prevention measures?,Apps provide monitoring and prevention advice.
Brownspot ,Can companion planting help prevent this disease?,Companion planting may create unfavorable conditions for the fungus.
Brownspot ,How do cover crops reduce the occurrence of this disease?,Cover crops can suppress fungal spores.
Brownspot ,Is it necessary to avoid planting in infected fields for several seasons?,Avoid planting in infected fields for at least one season.
Brownspot ,Are there any global campaigns for disease prevention?,Global campaigns raise awareness and support research.
Brownspot ,How does soil testing assist in preventing this disease?,Soil testing identifies nutrient deficiencies that increase risk.
Brownspot ,What is the role of agricultural extension services in prevention?,Extension services train farmers in prevention.
Brownspot ,How can farmers educate themselves about prevention?,Farmers can attend workshops for updated knowledge.
Brownspot ,Are there any grants available for disease prevention efforts?,Grants are available for sustainable disease management.
Brownspot ,What are the most cost-effective prevention strategies?,Cost-effective strategies include rotation and certified seeds.
Brownspot ,What treatments are available for this disease?,"Treatments include fungicides, biological agents, and field sanitation."
Brownspot ,How can this disease be treated effectively?,Effective treatment combines chemical and cultural methods.
Brownspot ,What chemical controls are recommended for this disease?,Fungicides like mancozeb are recommended.
Brownspot ,Can this disease be treated organically?,Organic treatments include neem oil and biofungicides.
Brownspot ,Are there specific fungicides or bactericides for this disease?,Specific fungicides like triazoles are effective.
Brownspot ,How should infected plants be handled during treatment?,Infected plants should be removed or treated promptly.
Brownspot ,What role does pruning play in treating this disease?,Pruning infected parts reduces spore spread.
Brownspot ,Can this disease be managed with biological methods?,Biological methods include introducing beneficial fungi.
Brownspot ,How frequently should treatments be applied for this disease?,Treatments should be applied at 7-14 day intervals.
Brownspot ,Are there any risks associated with treating this disease?,Risks include chemical resistance and environmental effects.
Brownspot ,Can infected fields be salvaged during harvest?,Heavily infected fields may require selective harvesting.
Brownspot ,What is the best time to apply treatments for this disease?,Early-stage treatment is most effective.
Brownspot ,How do weather conditions affect treatment success?,Weather conditions influence fungicide effectiveness.
Brownspot ,Should farmers mix treatments for this disease with fertilizers?,Mixing treatments with fertilizers is not recommended.
Brownspot ,How do irrigation practices change during treatment?,Irrigation should be adjusted to avoid excessive moisture.
Brownspot ,Are there field practices that complement chemical treatments?,Practices like crop rotation complement treatments.
Brownspot ,Can this disease be treated after symptoms appear?,"Yes, symptoms can be managed with prompt treatment."
Brownspot ,How do resistant varieties support treatment efforts?,Resistant varieties reduce treatment frequency.
Brownspot ,Should infected plant debris be removed immediately?,Plant debris should be removed immediately.
Brownspot ,Are there government-approved protocols for treating this disease?,Protocols include integrated pest management guidelines.
Brownspot ,What are some alternative treatments for this disease?,Alternatives include compost teas and organic sprays.
Brownspot ,How do biological treatments compare to chemical ones?,Biological treatments are eco-friendlier but slower.
Brownspot ,Can infected plants fully recover with proper treatment?,Early treatment can lead to full recovery.
Brownspot ,Are there eco-friendly treatment options available?,Eco-friendly options include neem oil sprays.
Brownspot ,How long does treatment take to show results?,Results appear within weeks of treatment.
Brownspot ,Should infected plants be removed immediately during treatment?,"Yes, removal of infected plants prevents further spread."
Brownspot ,Are there any traditional remedies for this disease?,Traditional remedies include ash application.
Brownspot ,Can this disease be controlled with mixed treatments?,Mixed treatments can enhance effectiveness.
Brownspot ,How do farmers know if a treatment is effective?,Farmers should monitor for reduced symptom severity.
Brownspot ,Should treatments be repeated if symptoms persist?,Repeat treatments may be necessary for persistent infections.
Brownspot ,Can drones or smart technology help apply treatments?,Drones apply treatments more efficiently in large fields.
Brownspot ,Are treatment costs sustainable for small-scale farmers?,Costs may be challenging for small-scale farmers.
Brownspot ,What mistakes should be avoided during treatment?,Avoid applying chemicals during high winds or rain.
Brownspot ,Are there any post-treatment measures to prevent recurrence?,Post-treatment measures include residue management.
Brownspot ,How does the timing of treatment affect its success?,Timing affects spore development and treatment success.
Brownspot ,Are there any side effects of using chemicals for treatment?,Side effects include reduced soil microbial diversity.
Brownspot ,How do weather conditions influence treatment application?,Treatments are less effective in wet conditions.
Brownspot ,Can treatment also protect neighboring fields?,Neighboring fields benefit from preventive treatment.
Brownspot ,Are combination treatments more effective for this disease?,Combination treatments target multiple fungal stages.
Brownspot ,What are the best practices for treating large-scale outbreaks?,Large-scale outbreaks require aerial application methods.
Brownspot ,When does this disease typically develop?,"Brown spot develops during humid, warm seasons."
Brownspot ,During which seasons is this disease most common?,Most common during wet seasons with high humidity.
Brownspot ,What weather conditions favor this disease?,"Warm, wet weather favors the disease."
Brownspot ,Does this disease develop faster in certain climates?,Faster development occurs in moderate to high temperatures.
Brownspot ,How do temperature changes affect this disease?,Temperatures between 20-30°C promote growth.
Brownspot ,What role does humidity play in the spread of this disease?,High humidity accelerates fungal spore germination.
Brownspot ,Are rainy seasons associated with outbreaks of this disease?,Rainy seasons often lead to outbreaks.
Brownspot ,How quickly does this disease spread in ideal conditions?,The disease spreads within days under ideal conditions.
Brownspot ,What time of year is best for preventing this disease?,"Dry, low-humidity seasons are best for prevention."
Brownspot ,How does soil moisture impact the occurrence of this disease?,High soil moisture supports fungal development.
Brownspot ,Are drought conditions linked to this disease?,Drought-stressed plants are more susceptible.
Brownspot ,Does wind speed affect the spread of this disease?,Wind spreads spores over long distances.
Brownspot ,How do prolonged wet conditions contribute to this disease?,Prolonged wet conditions increase disease severity.
Brownspot ,What time of day is best for monitoring this disease?,Monitor during early morning when dew is present.
Brownspot ,Can cool nights and warm days promote this disease?,"Yes, dew encourages fungal growth."
Brownspot ,How does overcrowding affect disease conditions?,Overcrowding increases humidity and spore spread.
Brownspot ,Does this disease spread more rapidly in poorly drained fields?,Poorly drained fields are highly susceptible.
Brownspot ,Are specific rice varieties more affected by seasonal changes?,Susceptibility varies with variety and planting conditions.
Brownspot ,What geographic regions report this disease most frequently?,Regions with monsoonal climates report frequent cases.
Brownspot ,How does climate change influence this disease?,Climate change may increase disease range and severity.
Brownspot ,Does this disease develop faster in flooded fields?,Flooded fields promote faster fungal growth.
Brownspot ,How does drought influence the spread of this disease?,Drought-stressed plants are more vulnerable.
Brownspot ,Are there specific months when this disease peaks?,Peak outbreaks occur during monsoon months.
Brownspot ,How long does it take for symptoms to appear after infection?,Symptoms appear 3-5 days after infection.
Brownspot ,Can this disease remain dormant during dry seasons?,The fungus may persist in residues during dry seasons.
Brownspot ,Does this disease spread faster in younger or older plants?,Younger plants are more vulnerable.
Brownspot ,How does temperature fluctuation affect disease progression?,"Temperature swings stress plants, increasing risk."
Brownspot ,What role does soil texture play in the development of this disease?,Soil texture affects water retention and humidity.
Brownspot ,Are there regions where this disease develops year-round?,Tropical regions often experience year-round disease activity.
Brownspot ,How does over-irrigation contribute to this disease's conditions?,Over-irrigation creates ideal fungal conditions.
Brownspot ,Are shaded rice fields more prone to this disease?,"Shaded fields retain moisture, favoring fungal growth."
Brownspot ,How do monsoon seasons affect the development of this disease?,Monsoons create high humidity for disease spread.
Brownspot ,Can controlled irrigation delay the onset of this disease?,Controlled irrigation reduces moisture buildup.
Brownspot ,Does this disease spread faster in poorly ventilated fields?,"Poor ventilation traps humidity, worsening symptoms."
Brownspot ,How do long planting seasons increase the risk of this disease?,Long seasons increase fungal exposure.
Brownspot ,Are specific growth stages of rice more vulnerable to this disease?,Tillering and booting stages are more vulnerable.
Brownspot ,How does nighttime dew affect the development of this disease?,Dew contributes to fungal spore germination.
Brownspot ,Is this disease more active during planting or harvest seasons?,Symptoms are more visible during grain development.
Brownspot ,How does wind affect the spread of this disease?,Wind aids in spore dispersal across fields.
Brownspot ,Can changing planting dates help avoid this disease's peak season?,Adjusting planting dates can avoid peak fungal seasons.
Brownspot ,What are the recommendations for managing this disease?,Recommendations include integrated pest management.
Brownspot ,How should farmers address outbreaks of this disease?,Address outbreaks with fungicides and sanitation.
Brownspot ,What advice is given for handling this disease effectively?,Experts advise regular field inspections.
Brownspot ,What actions should farmers take when this disease is detected?,Remove infected plants and apply fungicides.
Brownspot ,Are there government recommendations for this disease?,Government guidelines include certified seed use.
Brownspot ,What do agricultural experts suggest for managing this disease?,Experts suggest monitoring humidity and soil health.
Brownspot ,What field practices help control this disease?,Field practices include crop rotation and debris management.
Brownspot ,Should farmers consult professionals for this disease?,Consulting professionals ensures effective control.
Brownspot ,How do experienced farmers deal with this disease?,Experienced farmers recommend balanced fertilization.
Brownspot ,What is the first step in managing this disease?,The first step is accurate diagnosis.
Brownspot ,Are there workshops available for this disease management?,Workshops train farmers in preventive measures.
Brownspot ,How can farmers protect neighboring fields from this disease?,Protect neighbors by sharing early outbreak data.
Brownspot ,What role does collaboration play in disease management?,Collaboration includes shared tools and resources.
Brownspot ,How can farmers communicate outbreaks to others?,Farmers should communicate with local cooperatives.
Brownspot ,Are there online resources for learning about this disease?,Online resources include agricultural extension websites.
Brownspot ,Should farmers avoid planting in infected fields immediately?,Avoid replanting in infected fields for one season.
Brownspot ,What are the long-term recommendations for managing this disease?,Long-term management includes crop diversification.
Brownspot ,How can farmers integrate prevention and treatment efforts?,Prevention and treatment should be integrated.
Brownspot ,Are there subsidies for managing this disease?,Subsidies are available in some regions.
Brownspot ,What should be done after treating fields for this disease?,"Post-treatment, monitor fields regularly for recurrence."
Brownspot ,What do experts recommend for managing this disease effectively?,Experts recommend proactive measures and resistant varieties.
Brownspot ,How can farmers coordinate with others to control outbreaks?,Coordination reduces cross-contamination risks.
Brownspot ,Are there specific organizations supporting farmers with this disease?,Organizations like IRRI provide support.
Brownspot ,What tools should farmers use for early detection of this disease?,Detection tools include drones and molecular kits.
Brownspot ,Are there educational workshops available for disease management?,Educational workshops teach disease identification and control.
Brownspot ,How can farmers report outbreaks to local authorities?,Report outbreaks to agricultural extension offices.
Brownspot ,Should farmers implement stricter sanitation protocols?,Sanitation includes removing debris and disinfecting tools.
Brownspot ,What role does government policy play in disease management?,Policies support resistant variety adoption.
Brownspot ,How can farmers integrate disease control with daily practices?,Daily practices should include regular inspections.
Brownspot ,Are there mobile apps for tracking and advising on this disease?,Mobile apps assist with disease monitoring.
Brownspot ,Should farmers consult agronomists for this disease's management?,Agronomists offer tailored advice for disease control.
Brownspot ,What financial support is available for managing large-scale outbreaks?,Financial support includes government and NGO grants.
Brownspot ,How do disease-free certifications benefit farmers?,Certification improves market access and farm reputation.
Brownspot ,Can cooperative farming reduce disease risks?,Cooperative farming reduces disease spread.
Brownspot ,Are there community programs to spread awareness about this disease?,Community programs raise awareness and promote prevention.
Brownspot ,How can farmers create a long-term plan to combat this disease?,Long-term plans include soil health improvement.
Brownspot ,Are there case studies of successful management of this disease?,Case studies show the success of integrated management.
Brownspot ,How can farmers protect unaffected fields during outbreaks?,Protect fields by applying fungicides preventively.
Brownspot ,Are there climate-specific strategies for managing this disease?,Climate-specific strategies include adjusted planting dates.
Brownspot ,What are the long-term impacts of not following recommended advice?,Ignoring advice leads to reduced yields and repeated outbreaks.
Tungro,What is this disease?,Tungro is a viral disease affecting rice crops.
Tungro,Can you explain what this disease is?,Tungro is caused by a combination of Rice Tungro Bacilliform Virus (RTBV) and Rice Tungro Spherical Virus (RTSV).
Tungro,How would you describe this disease?,Tungro is a devastating rice disease marked by stunted growth and yellowing leaves.
Tungro,What does this disease mean for rice crops?,This disease leads to reduced rice crop yields and poor grain quality.
Tungro,How serious is this disease in agriculture?,Tungro is highly serious and can cause up to 100% yield loss if left unmanaged.
Tungro,What is the definition of this disease?,Tungro is defined as a complex viral disease of rice caused by RTBV and RTSV.
Tungro,How is this disease categorized?,Tungro is categorized as a plant viral disease.
Tungro,Why is this disease considered harmful?,Tungro is harmful because it stunts rice growth and significantly reduces yields.
Tungro,What makes this disease unique among plant diseases?,Tungro is unique because it involves two viruses transmitted by leafhoppers.
Tungro,What does this disease target in rice plants?,Tungro primarily targets the leaves and growth of rice plants.
Tungro,How does this disease affect plant physiology?,Tungro disrupts photosynthesis and nutrient uptake in rice plants.
Tungro,What is the main characteristic of this disease?,The main characteristic of Tungro is yellow-orange discoloration of leaves.
Tungro,Could you elaborate on the specifics of this disease?,Tungro is a disease complex involving vector transmission and dual viral infection.
Tungro,What is known about this disease historically?,Tungro was first identified in Southeast Asia and has a history of severe outbreaks.
Tungro,What are the main features of this disease?,"Key features include stunting, yellowing leaves, and reduced tillering."
Tungro,What role does this disease play in crop failures?,Tungro plays a critical role in rice crop failures in tropical regions.
Tungro,How do farmers typically identify this disease?,Farmers identify Tungro by yellowing leaves and stunted plant growth.
Tungro,What is the impact of this disease globally?,"Globally, Tungro severely impacts rice production, especially in Asia."
Tungro,What are the critical points to know about this disease?,The critical points include vector control and resistant varieties for management.
Tungro,How is this disease classified scientifically?,Tungro is scientifically classified under plant virology and vector-borne diseases.
Tungro,Is this disease specific to rice crops?,Tungro is specific to rice crops.
Tungro,What crops other than rice are affected by this disease?,Tungro primarily affects rice and no other crops significantly.
Tungro,What is the history of this disease in agriculture?,Tungro's history in agriculture includes severe outbreaks in Asia since the 1960s.
