disease,question,answer
Blast,What is this disease?,Rice blast is a fungal disease caused by Magnaporthe oryzae that affects rice crops.
Blast,Can you explain what this disease is?,"It is a plant disease that results in lesions on leaves, stems, and panicles, reducing crop yields significantly."
Blast,How would you describe this disease?,Rice blast is a fungal infection that impacts the growth and productivity of rice by creating lesions and reducing the plant's vigor.
Blast,What does this disease mean for rice crops?,"This disease leads to reduced yields and poor grain quality, threatening food security."
Blast,How serious is this disease in agriculture?,"Rice blast is one of the most serious diseases in rice cultivation, causing up to 50% yield loss in severe cases."
Blast,What is the definition of this disease?,Rice blast is defined as a fungal disease caused by the pathogen Magnaporthe oryzae.
Blast,How is this disease categorized?,"It is categorized as a fungal disease, specifically affecting rice plants."
Blast,Why is this disease considered harmful?,"It is harmful because it spreads rapidly, damages plant tissues, and significantly reduces crop yields."
Blast,What makes this disease unique among plant diseases?,"Rice blast is unique due to its rapid spread and the diversity of its strains, making control difficult."
Blast,What does this disease target in rice plants?,"It targets the leaves, stems, nodes, and panicles of rice plants."
Blast,How does this disease affect plant physiology?,"The disease disrupts photosynthesis, weakens the plant structure, and reduces nutrient transport."
Blast,What is the main characteristic of this disease?,The main characteristic is the development of gray or whitish lesions with brown borders on leaves.
Blast,Could you elaborate on the specifics of this disease?,"Rice blast is caused by a fungus that infects the aerial parts of the rice plant, leading to yield loss."
Blast,What is known about this disease historically?,"Historically, rice blast has been known for centuries and is a major constraint in rice production worldwide."
Blast,What are the main features of this disease?,"Key features include elliptical lesions on leaves, stem breakage, and poor grain filling."
Blast,What role does this disease play in crop failures?,Rice blast contributes to crop failures by destroying plant tissues and reducing grain production.
Blast,How do farmers typically identify this disease?,Farmers identify it by the characteristic diamond-shaped lesions on leaves and necrotic tissues.
Blast,What is the impact of this disease globally?,"Globally, it impacts food security by causing significant yield losses in rice-growing regions."
Blast,What are the critical points to know about this disease?,"Critical points include its fungal origin, its rapid spread, and its severe impact on rice productivity."
Blast,How is this disease classified scientifically?,"It is classified under fungal diseases, caused by Magnaporthe oryzae."
Blast,Is this disease specific to rice crops?,"While specific to rice, it also affects other Poaceae family members under conducive conditions."
Blast,What crops other than rice are affected by this disease?,It can infect grasses and other cereal crops like wheat under experimental conditions.
Blast,What is the history of this disease in agriculture?,"It has a long history of causing rice production challenges, particularly in Asia and Africa."
Blast,How has this disease evolved over time?,The disease has evolved with changing agricultural practices and climate conditions.
Blast,Is this disease preventable with modern farming techniques?,Modern techniques like resistant varieties and integrated pest management help prevent it.
Blast,What are the most common misconceptions about this disease?,A common misconception is that it only occurs in wet conditions; it can also occur in drought-stressed plants.
Blast,How long has this disease been known in rice farming?,It has been documented for over a century in rice farming regions worldwide.
Blast,How widespread is this disease in the world?,"Rice blast is widespread, especially in tropical and subtropical regions with high humidity."
Blast,Can this disease be completely eradicated?,Eradication is difficult due to the fungus's ability to survive on crop residues and its genetic diversity.
Blast,How does this disease differ from other plant diseases?,It differs by its ability to infect multiple parts of the plant and its environmental adaptability.
Blast,What is the role of farmers in managing this disease?,Farmers play a role by adopting preventive measures like resistant varieties and field sanitation.
Blast,How quickly can this disease spread in a rice field?,"The disease can spread within days in ideal conditions, devastating a field quickly."
Blast,How does the agricultural industry monitor this disease?,"Monitoring includes field inspections, early symptom detection, and predictive modeling."
Blast,What is the biggest challenge in managing this disease?,The biggest challenge is managing its rapid spread and the emergence of resistant fungal strains.
Blast,What research is being done to combat this disease?,"Researchers study resistance genes, fungicide efficacy, and integrated management strategies."
Blast,What is the scientific name of the pathogen causing this disease?,The pathogen causing rice blast is Magnaporthe oryzae.
Blast,How has this disease impacted global rice production?,"It has caused significant losses in rice production, particularly in Asia and Africa."
Blast,Are there regions where this disease is more common?,"Regions with high humidity and warm temperatures, such as Southeast Asia, are more prone."
Blast,How do researchers identify this disease in the lab?,Researchers use morphological and molecular techniques to identify it in labs.
Blast,What are some success stories in controlling this disease?,Success stories include using resistant varieties and fungicides in integrated programs.
Blast,What symptoms indicate this disease in plants?,Symptoms include grayish lesions with brown margins on leaves and panicles.
Blast,How does this disease appear on rice crops?,Lesions appear as diamond-shaped spots on leaves and necrotic tissues on stems.
Blast,What are the visible signs of this disease?,"Visible signs include wilting, browning, and stem breakage in advanced stages."
Blast,What key symptoms should farmers monitor for this disease?,Farmers monitor for leaf lesions and reduced plant vigor to identify symptoms.
Blast,How early can symptoms of this disease be detected?,Symptoms can be detected as early as the seedling stage in conducive conditions.
Blast,What distinguishes this disease's symptoms from others?,Rice blast symptoms are unique due to their elliptical shape and gray center.
Blast,Are there specific symptoms on the leaves caused by this disease?,"Leaf symptoms include small, spindle-shaped lesions that expand as the disease progresses."
Blast,How do symptoms of this disease progress over time?,"Symptoms progress from small spots to large lesions, eventually causing plant death."
Blast,What are the initial signs of this disease in plants?,"Initial signs include small, water-soaked spots on leaves."
Blast,How can farmers differentiate this disease from similar ones?,Differences include the characteristic gray center and brown border of lesions.
Blast,"Does this disease cause discoloration? If so, how?","Yes, the disease causes discoloration, often with a grayish center and brown edge."
Blast,What physical changes occur in plants due to this disease?,"Physical changes include wilting, reduced growth, and necrotic tissues."
Blast,Does this disease cause damage to plant roots or leaves?,It primarily affects leaves and panicles but may cause limited root damage indirectly.
Blast,What happens to rice plants in the advanced stages of this disease?,"In advanced stages, plants show stem breakage, poor grain filling, and necrosis."
Blast,Are there any specific growth stunts caused by this disease?,Growth stunting occurs due to reduced photosynthesis and weakened plant tissues.
Blast,What happens to the grain quality when this disease occurs?,"Grain quality is compromised, often with shriveled, poorly filled grains."
Blast,How visible are the symptoms of this disease during harvest?,Symptoms like necrotic panicles and poor grain development are visible at harvest.
Blast,Does this disease spread uniformly across the plant?,"The disease spreads non-uniformly, affecting parts of the plant exposed to spores."
Blast,What happens to infected plants if untreated?,"Untreated plants die prematurely, leading to complete crop failure in severe cases."
Blast,Are the symptoms of this disease affected by environmental factors?,Environmental factors like humidity and temperature influence symptom severity.
Blast,How does this disease affect young rice plants differently than mature plants?,Young plants exhibit stunted growth and smaller lesions compared to mature plants.
Blast,Are the symptoms more severe during specific growth stages?,Symptoms are often more severe during reproductive stages like panicle emergence.
Blast,Can this disease cause irreversible damage to rice plants?,"Yes, the disease can cause irreversible damage if untreated."
Blast,What does this disease look like under a microscope?,"Under a microscope, spores of M. oryzae are visible as pear-shaped structures."
Blast,Do symptoms of this disease vary by rice variety?,"Symptoms may vary, with some varieties showing smaller or fewer lesions."
Blast,How do farmers typically identify symptoms in the field?,Symptoms are identified through regular field inspections and close observation.
Blast,Does this disease affect only the leaves or other parts of the plant as well?,"It affects leaves, stems, and panicles, leading to visible damage in all parts."
Blast,What secondary infections can occur due to this disease?,Secondary infections like bacterial leaf blight may occur in weakened plants.
Blast,How can early symptoms of this disease be distinguished from nutrient deficiencies?,"Nutrient deficiencies cause uniform discoloration, unlike the spotted lesions of rice blast."
Blast,Does this disease cause any unusual changes in plant behavior?,"Yes, unusual leaf curling or premature yellowing may occur."
Blast,Are there visual signs on rice grains caused by this disease?,Visible signs on grains include shriveled or discolored kernels.
Blast,How do symptoms progress in untreated cases of this disease?,Symptoms worsen with larger lesions and greater necrosis in untreated cases.
Blast,Are there subtle symptoms that might go unnoticed?,"Subtle symptoms like small, water-soaked spots may go unnoticed initially."
Blast,What happens to the root system in plants affected by this disease?,The root system is not directly affected but may suffer due to overall plant weakness.
Blast,Does the disease cause structural changes to rice plants?,Structural changes include weakened stems and reduced tiller numbers.
Blast,Can symptoms be detected with the naked eye?,"Yes, symptoms like leaf lesions and necrotic tissues are visible to the naked eye."
Blast,How do environmental conditions affect symptom severity?,Conditions like high humidity increase lesion size and severity.
Blast,Are the symptoms of this disease different in dry fields versus flooded fields?,Symptoms are often more severe in flooded fields due to favorable humidity.
Blast,Can modern tools like drones detect symptoms of this disease?,"Yes, drones with imaging sensors can detect early-stage symptoms."
Blast,Are there patterns in how symptoms spread across the plant?,Symptoms spread in patterns influenced by spore dispersion through wind or water.
Blast,What causes this disease?,Rice blast is caused by the fungus Magnaporthe oryzae.
Blast,What are the primary triggers for this disease?,"Primary triggers include high humidity, warm temperatures, and infected seeds."
Blast,How does this disease originate in rice crops?,It originates from spores that infect plant tissues under favorable conditions.
Blast,What environmental factors contribute to this disease?,"High humidity, rainfall, and warm temperatures contribute to its occurrence."
Blast,How is this disease introduced into fields?,"It spreads through infected seeds, windborne spores, and contaminated equipment."
Blast,What specific pathogens are responsible for this disease?,The specific pathogen is Magnaporthe oryzae.
Blast,How does the lifecycle of this disease begin?,The lifecycle begins with spore germination and infection of plant tissues.
Blast,"Is this disease caused by bacteria, fungi, or viruses?",It is caused by a fungus.
Blast,What human actions might lead to the development of this disease?,Poor sanitation and use of infected seeds contribute to its development.
Blast,What climatic conditions allow this disease to thrive?,"Warm, humid climates promote its spread."
Blast,Does irrigation water play a role in spreading this disease?,Contaminated irrigation water can transport fungal spores to fields.
Blast,How do soil conditions affect the occurrence of this disease?,Waterlogged soils provide ideal conditions for fungal growth.
Blast,Is this disease caused by pests acting as vectors?,Pests like planthoppers may act as vectors under certain conditions.
Blast,Does this disease spread from plant to plant?,"Yes, it spreads via airborne spores and water splash."
Blast,Can wind or rain contribute to this disease?,Wind and rain facilitate the dispersal of fungal spores.
Blast,What role do insects play in transmitting this disease?,"Insects can occasionally carry spores, aiding spread."
Blast,How do farmers unknowingly spread this disease?,Farmers spread it by using contaminated tools or moving infected plants.
Blast,Is seed quality related to the occurrence of this disease?,Low-quality seeds often harbor fungal spores.
Blast,Are weeds in fields responsible for harboring this disease?,"Weeds can host the fungus, contributing to its spread."
Blast,What role does crop residue play in spreading this disease?,Crop residue left in fields provides a habitat for the fungus.
Blast,Are there genetic factors that make plants more susceptible to this disease?,"Genetic susceptibility varies, with some varieties more prone to infection."
Blast,Can weather alone trigger this disease?,Weather alone can trigger outbreaks if conditions are favorable.
Blast,Are certain pests responsible for spreading this disease?,Some pests may indirectly assist by creating wounds for fungal entry.
Blast,How does poor field sanitation lead to this disease?,Poor field sanitation increases fungal spore availability.
Blast,Can excessive fertilizer application cause this disease?,Overuse of nitrogen fertilizers can exacerbate infection.
Blast,Are there specific types of irrigation systems linked to this disease?,Overhead irrigation systems may splash spores onto healthy plants.
Blast,How does the pathogen causing this disease survive between seasons?,The pathogen survives on crop residue and infected seeds between seasons.
Blast,Does soil type influence the occurrence of this disease?,"Heavy, poorly drained soils increase disease risk."
Blast,Can this disease be introduced through infected seeds?,Infected seeds are a primary source of disease introduction.
Blast,Are there specific farming practices that contribute to this disease?,Practices like monocropping without rotation increase risk.
Blast,How do neighboring infected fields affect disease spread?,Spores from neighboring infected fields can spread via wind or water.
Blast,Is this disease influenced by changes in climate patterns?,"Climate change, with unpredictable weather, may increase outbreaks."
Blast,Are high-altitude rice fields less prone to this disease?,High-altitude fields often face fewer issues due to cooler temperatures.
Blast,How does organic farming impact the occurrence of this disease?,Organic farming practices may reduce risk by improving soil health.
Blast,Does this disease have multiple causes or just one?,"Multiple factors like genetics, environment, and practices contribute."
Blast,Can animals inadvertently spread this disease?,Animals can spread spores by carrying them on fur or hooves.
Blast,What part of the plant is first affected by the pathogen?,Leaves are usually the first part affected by the pathogen.
Blast,Does this disease have a dormant phase during the year?,The disease can survive in a dormant state in crop residue.
Blast,How does human activity accelerate the spread of this disease?,Activities like transporting infected plants can accelerate spread.
Blast,Are there unknown factors contributing to this disease?,Unknown factors like fungal strain mutations may also play a role.
Blast,How does this disease affect crop yield?,Crop yield is reduced due to tissue damage and poor grain development.
Blast,What impact does this disease have on productivity?,Productivity declines as affected plants fail to produce healthy grains.
Blast,How much yield loss is typically caused by this disease?,Yield loss ranges from 10% to 50% in severe cases.
Blast,What happens to harvests if this disease is left untreated?,Harvests diminish significantly without treatment.
Blast,Does this disease affect both quantity and quality of the yield?,Both quantity and quality are adversely affected.
Blast,Can this disease lead to complete crop failure?,Complete crop failure can occur in severe outbreaks.
Blast,How does this disease affect grain development in rice?,"Grain development suffers, resulting in poor filling and discoloration."
Blast,Does this disease reduce the size of harvestable grains?,"Yes, infected grains are often smaller and lighter."
Blast,How does the infection rate correlate with yield loss?,Higher infection rates lead to greater yield losses.
Blast,What economic impact does this disease have on farmers?,Farmers face reduced income and higher input costs.
Blast,How does this disease affect the nutritional value of crops?,The nutritional quality of rice declines due to poor grain filling.
Blast,Are there visible differences in affected and unaffected crops?,Affected crops show poor growth and necrotic tissues.
Blast,How does this disease impact the market value of rice?,Market value drops due to poor grain quality and yield.
Blast,Does this disease lead to uneven growth in rice fields?,Uneven growth patterns emerge in fields due to infection variability.
Blast,What are the long-term impacts on fields with frequent disease outbreaks?,Repeated outbreaks degrade soil health and increase disease persistence.
Blast,How does this disease interact with other stress factors on plants?,Combined stress factors worsen the disease's impact on plants.
Blast,Is the loss caused by this disease uniform across all rice varieties?,Losses vary depending on the variety's resistance.
Blast,What role does early detection play in reducing yield loss?,Early detection prevents severe yield losses.
Blast,How does this disease affect the milling quality of rice grains?,Poor milling quality results from damaged grains.
Blast,Can this disease lead to replanting costs for farmers?,Replanting costs rise when fields are severely affected.
Blast,Does this disease always lead to yield losses?,Yield losses depend on infection severity and management.
Blast,What is the average yield loss caused by this disease worldwide?,Average global yield losses are around 10-30%.
Blast,Are organic farms more or less affected by this disease?,Organic farms may face less severity due to healthier ecosystems.
Blast,How does the disease affect grain size and weight?,Infected grains are often smaller and have reduced weight.
Blast,Are infected crops more likely to attract pests?,Infected crops may attract pests like stem borers.
Blast,Does this disease reduce the nutritional value of the rice produced?,Nutritional value declines due to poorly developed grains.
Blast,How does this disease affect the appearance of rice grains?,Affected grains appear discolored and shriveled.
Blast,Are there studies quantifying the economic impact of this disease?,Economic studies highlight significant losses in Asia and Africa.
Blast,How much time does it take for yield losses to become noticeable?,Yield losses become noticeable within weeks of severe infection.
Blast,Are there indirect impacts on productivity caused by this disease?,Secondary impacts include higher pest susceptibility and input costs.
Blast,Can infected plants still produce viable seeds?,Infected plants may produce viable seeds but at a lower rate.
Blast,How does this disease affect overall field uniformity?,Fields lose uniformity due to patchy disease spread.
Blast,What percentage of the field is typically affected in severe cases?,Severe cases can affect 50% or more of a field.
Blast,Are yield losses from this disease consistent across regions?,"Regional losses depend on climate, variety, and management."
Blast,How does delayed treatment increase yield losses?,Delayed treatment exacerbates yield losses.
Blast,Can modern farming technology mitigate yield losses?,Technology like resistant varieties and fungicides mitigates losses.
Blast,Are there long-term soil effects from this disease?,Residual soil effects include fungal spore buildup.
Blast,Can this disease cause farmers to abandon fields entirely?,Severe cases may lead to field abandonment.
Blast,Are export-quality rice grains impacted more by this disease?,Export-quality grains are significantly impacted by poor appearance.
Blast,How does this disease affect farmer incomes directly?,Farmers' incomes decline due to reduced yields and quality.
Blast,How can this disease be prevented?,"Prevention involves resistant varieties, sanitation, and crop rotation."
Blast,What are effective prevention strategies for this disease?,Effective strategies include proper water management and seed treatment.
Blast,What can farmers do to reduce the risk of this disease?,Farmers can minimize risk by using certified seeds and maintaining hygiene.
Blast,How should fields be prepared to prevent this disease?,Fields should be cleared of debris and leveled to avoid waterlogging.
Blast,What preventive measures can be taken during the planting season?,"Planting clean, treated seeds helps prevent outbreaks."
Blast,Are there any resistant varieties to this disease?,Resistant varieties like IR64 reduce susceptibility.
Blast,What role does crop rotation play in preventing this disease?,Crop rotation limits fungal spore survival.
Blast,How does water management help prevent this disease?,Proper water management prevents fungal spread.
Blast,Can the use of fertilizers prevent this disease?,Balanced fertilizer application reduces stress on plants.
Blast,What role does field sanitation play in disease prevention?,Field sanitation removes potential fungal habitats.
Blast,Should farmers remove infected plants to prevent spread?,Removing infected plants stops spore dispersal.
Blast,Are there any biological controls for this disease?,Biological controls like Trichoderma fungi can suppress pathogens.
Blast,How does avoiding overcrowding help prevent this disease?,Avoiding overcrowding improves airflow and reduces humidity.
Blast,What should farmers avoid doing to prevent this disease?,Farmers should avoid over-fertilizing and planting susceptible varieties.
Blast,Can monitoring weather forecasts help in disease prevention?,Weather monitoring helps anticipate conditions conducive to the disease.
Blast,Are there specific tools for detecting this disease early?,Tools like spore traps assist in early detection.
Blast,How do seed treatments help prevent this disease?,Seed treatments with fungicides prevent fungal infections.
Blast,What role does pest control play in preventing this disease?,Pest control limits secondary infections and fungal vectors.
Blast,Are there government recommendations for disease prevention?,Governments recommend resistant varieties and good farming practices.
Blast,How does maintaining healthy soil help avoid this disease?,Healthy soil reduces plant stress and disease susceptibility.
Blast,What advanced techniques are available to prevent this disease?,Advanced techniques include drone surveillance and spore detection.
Blast,Can using specific fertilizers reduce the risk of this disease?,Fertilizers that promote balanced growth help reduce risks.
Blast,How does proper drainage help prevent this disease?,Drainage prevents waterlogging and fungal proliferation.
Blast,Are there natural ways to prevent this disease without chemicals?,Mulching and organic amendments reduce pathogen survival.
Blast,Does planting resistant rice varieties guarantee prevention?,Resistant varieties significantly lower but do not eliminate risk.
Blast,Can weather prediction tools help in disease prevention?,"Weather tools predict conducive conditions, aiding prevention."
Blast,How often should fields be inspected to prevent this disease?,Frequent inspections identify early signs of infection.
Blast,Are there community-level prevention strategies for this disease?,Community efforts like shared monitoring improve prevention.
Blast,Can crop diversification help in prevention efforts?,Diversifying crops reduces disease pressure.
Blast,How does seed quality testing help in prevention?,Testing seeds for fungal spores ensures clean planting material.
Blast,Are there apps or tools for monitoring prevention measures?,Apps help farmers track and implement preventive measures.
Blast,Can companion planting help prevent this disease?,Companion planting reduces fungal spread.
Blast,How do cover crops reduce the occurrence of this disease?,Cover crops like legumes improve soil health and reduce fungal survival.
Blast,Is it necessary to avoid planting in infected fields for several seasons?,Avoiding planting in infected fields disrupts the fungal lifecycle.
