disease,question,answer
Bacterialblight,How does overcrowding affect disease conditions?,"Overcrowding traps humidity, creating a conducive environment."
Bacterialblight,Does this disease spread more rapidly in poorly drained fields?,"Poor drainage increases waterlogged conditions, worsening the disease."
Bacterialblight,Are specific rice varieties more affected by seasonal changes?,"Varieties differ in susceptibility, but some show consistent resistance."
Bacterialblight,What geographic regions report this disease most frequently?,"Southeast Asia, India, and other tropical areas report frequent outbreaks."
Bacterialblight,How does climate change influence this disease?,Climate change increases outbreaks due to more extreme weather conditions.
Bacterialblight,Does this disease develop faster in flooded fields?,Flooded fields show higher infection rates due to bacterial spread in water.
Bacterialblight,How does drought influence the spread of this disease?,Drought reduces spread but delays plant recovery from infection.
Bacterialblight,Are there specific months when this disease peaks?,Peak months coincide with the rainy season in most regions.
Bacterialblight,How long does it take for symptoms to appear after infection?,Symptoms appear within 14 days under optimal conditions.
Bacterialblight,Can this disease remain dormant during dry seasons?,The disease can remain dormant in residues during dry periods.
Bacterialblight,Does this disease spread faster in younger or older plants?,Young plants show faster symptom development due to vulnerability.
Bacterialblight,How does temperature fluctuation affect disease progression?,Temperature shifts affect bacterial growth and spread rates.
Bacterialblight,What role does soil texture play in the development of this disease?,Loamy soils with high water retention exacerbate disease risk.
Bacterialblight,Are there regions where this disease develops year-round?,"Warm, humid regions may experience year-round disease presence."
Bacterialblight,How does over-irrigation contribute to this disease's conditions?,Over-irrigation increases bacterial spread and persistence.
Bacterialblight,Are shaded rice fields more prone to this disease?,"Shaded fields retain moisture, increasing risk."
Bacterialblight,How do monsoon seasons affect the development of this disease?,Monsoon seasons promote widespread bacterial outbreaks.
Bacterialblight,Can controlled irrigation delay the onset of this disease?,"Controlled irrigation reduces humidity, delaying onset."
Bacterialblight,Does this disease spread faster in poorly ventilated fields?,Poor ventilation increases humidity and bacterial spread.
Bacterialblight,How do long planting seasons increase the risk of this disease?,Long planting seasons allow bacteria more time to multiply.
Bacterialblight,Are specific growth stages of rice more vulnerable to this disease?,Early growth stages are more vulnerable to infection.
Bacterialblight,How does nighttime dew affect the development of this disease?,Nighttime dew accelerates bacterial spread and infection.
Bacterialblight,Is this disease more active during planting or harvest seasons?,Planting seasons coincide with the highest disease activity.
Bacterialblight,How does wind affect the spread of this disease?,"Wind carries bacteria across fields, spreading infection."
Bacterialblight,Can changing planting dates help avoid this disease's peak season?,Adjusting planting dates avoids peak infection periods.
Bacterialblight,What are the recommendations for managing this disease?,"Management includes resistant varieties, sanitation, and water control."
Bacterialblight,How should farmers address outbreaks of this disease?,Address outbreaks with immediate removal of infected plants and bactericides.
Bacterialblight,What advice is given for handling this disease effectively?,"Effective handling requires monitoring, sanitation, and chemical controls."
Bacterialblight,What actions should farmers take when this disease is detected?,Farmers should isolate infected plants and reduce humidity in fields.
Bacterialblight,Are there government recommendations for this disease?,Government advice emphasizes resistant varieties and integrated management.
Bacterialblight,What do agricultural experts suggest for managing this disease?,"Experts recommend timely detection, resistant seeds, and proper irrigation."
Bacterialblight,What field practices help control this disease?,"Best practices include debris removal, balanced fertilizer use, and monitoring."
Bacterialblight,Should farmers consult professionals for this disease?,Consulting professionals ensures proper diagnosis and treatment.
Bacterialblight,How do experienced farmers deal with this disease?,Experienced farmers prioritize sanitation and resistant varieties.
Bacterialblight,What is the first step in managing this disease?,Early detection and immediate removal of infected debris are crucial.
Bacterialblight,Are there workshops available for this disease management?,Workshops are available through agricultural extension services.
Bacterialblight,How can farmers protect neighboring fields from this disease?,Neighboring fields can be protected by reducing water movement.
Bacterialblight,What role does collaboration play in disease management?,Collaboration ensures broader and more effective disease control.
Bacterialblight,How can farmers communicate outbreaks to others?,Farmers should report outbreaks to local agricultural authorities.
Bacterialblight,Are there online resources for learning about this disease?,Online resources provide guides and treatment plans.
Bacterialblight,Should farmers avoid planting in infected fields immediately?,Avoid planting in infected fields for 1–2 seasons.
Bacterialblight,What are the long-term recommendations for managing this disease?,"Long-term strategies include rotation, resistant varieties, and education."
Bacterialblight,How can farmers integrate prevention and treatment efforts?,Integrating prevention with timely treatment reduces risks.
Bacterialblight,Are there subsidies for managing this disease?,Subsidies are available for resistant seeds and advanced tools.
Bacterialblight,What should be done after treating fields for this disease?,Post-treatment actions include field sanitation and monitoring.
Bacterialblight,What do experts recommend for managing this disease effectively?,Experts recommend integrated pest management and regular inspections.
Bacterialblight,How can farmers coordinate with others to control outbreaks?,Coordinating with others helps prevent regional outbreaks.
Bacterialblight,Are there specific organizations supporting farmers with this disease?,Organizations like FAO support farmers with disease prevention tools.
Bacterialblight,What tools should farmers use for early detection of this disease?,Tools like field kits and drones enable early detection.
Bacterialblight,Are there educational workshops available for disease management?,Educational workshops are hosted by agricultural universities.
Bacterialblight,How can farmers report outbreaks to local authorities?,Farmers should report outbreaks for coordinated regional management.
Bacterialblight,Should farmers implement stricter sanitation protocols?,"Strict sanitation, including tool cleaning, prevents recurrence."
Bacterialblight,What role does government policy play in disease management?,Policies promote resistant varieties and improved farming practices.
Bacterialblight,How can farmers integrate disease control with daily practices?,Integrating disease control with daily activities ensures better outcomes.
Bacterialblight,Are there mobile apps for tracking and advising on this disease?,Apps help track outbreaks and recommend treatments.
Bacterialblight,Should farmers consult agronomists for this disease's management?,Agronomists provide expert advice for managing the disease.
Bacterialblight,What financial support is available for managing large-scale outbreaks?,Financial support is available for farmers managing widespread outbreaks.
Bacterialblight,How do disease-free certifications benefit farmers?,Disease-free certifications improve market access and trust.
Bacterialblight,Can cooperative farming reduce disease risks?,Cooperative efforts reduce individual risks and increase success.
Bacterialblight,Are there community programs to spread awareness about this disease?,Community programs spread knowledge and prevention techniques.
Bacterialblight,How can farmers create a long-term plan to combat this disease?,"Long-term plans involve diversification, resistant varieties, and sanitation."
Bacterialblight,Are there case studies of successful management of this disease?,Case studies show reduced outbreaks with resistant varieties and early detection.
Bacterialblight,How can farmers protect unaffected fields during outbreaks?,Protect unaffected fields by isolating infected areas.
Bacterialblight,Are there climate-specific strategies for managing this disease?,Climate-specific strategies focus on humidity control and resistant varieties.
Bacterialblight,What are the long-term impacts of not following recommended advice?,"Ignoring advice leads to severe losses, soil degradation, and recurring outbreaks."
Brownspot ,What is this disease?,Brown spot is a fungal disease that affects rice crops.
Brownspot ,Can you explain what this disease is?,"It is caused by the fungus Bipolaris oryzae and leads to brown lesions on rice leaves, grains, and other parts of the plant."
Brownspot ,How would you describe this disease?,Brown spot is a fungal infection characterized by brown lesions that reduce the health and productivity of rice plants.
Brownspot ,What does this disease mean for rice crops?,"It reduces the yield and quality of rice, causing economic losses for farmers."
Brownspot ,How serious is this disease in agriculture?,"It is considered a significant threat in rice farming, particularly in areas with poor management practices."
Brownspot ,What is the definition of this disease?,Brown spot is defined as a fungal disease caused by Bipolaris oryzae.
Brownspot ,How is this disease categorized?,It is categorized as a fungal foliar disease affecting rice crops.
Brownspot ,Why is this disease considered harmful?,"It is harmful because it reduces yield, grain quality, and overall plant health."
Brownspot ,What makes this disease unique among plant diseases?,Its ability to thrive in various conditions and persist in crop residues makes it unique.
Brownspot ,What does this disease target in rice plants?,"It primarily targets leaves, seeds, and stems of rice plants."
Brownspot ,How does this disease affect plant physiology?,"It disrupts photosynthesis and weakens plant physiology, reducing productivity."
Brownspot ,What is the main characteristic of this disease?,"The main characteristic is the appearance of small, brown, circular lesions on leaves."
Brownspot ,Could you elaborate on the specifics of this disease?,Brown spot develops under humid conditions and affects plant health significantly.
Brownspot ,What is known about this disease historically?,"Historically, it has been linked to major rice famines, such as the Bengal famine of 1943."
Brownspot ,What are the main features of this disease?,"Main features include brown lesions on leaves, reduced grain quality, and yield losses."
Brownspot ,What role does this disease play in crop failures?,Brown spot plays a role in crop failures by reducing grain filling and weakening plants.
Brownspot ,How do farmers typically identify this disease?,Farmers identify it by observing brown lesions on leaves and seeds.
Brownspot ,What is the impact of this disease globally?,"It has a global impact, especially in regions with low-input farming practices."
Brownspot ,What are the critical points to know about this disease?,"Key points include fungal origin, environmental triggers, and preventive strategies."
Brownspot ,How is this disease classified scientifically?,"Scientifically, it belongs to the group of fungal plant diseases caused by Bipolaris oryzae."
Brownspot ,Is this disease specific to rice crops?,It primarily affects rice but can also infect other grasses.
Brownspot ,What crops other than rice are affected by this disease?,Some wild grass species may also host the fungus.
Brownspot ,What is the history of this disease in agriculture?,It has been known for centuries and has caused significant agricultural losses.
Brownspot ,How has this disease evolved over time?,It has evolved with changes in environmental and agricultural practices.
Brownspot ,Is this disease preventable with modern farming techniques?,"Yes, prevention is possible with resistant varieties and good management."
Brownspot ,What are the most common misconceptions about this disease?,A common misconception is that it only occurs under wet conditions.
Brownspot ,How long has this disease been known in rice farming?,"It has been recognized for centuries, particularly in tropical rice-growing regions."
Brownspot ,How widespread is this disease in the world?,It is widespread in tropical and subtropical areas.
Brownspot ,Can this disease be completely eradicated?,Complete eradication is difficult due to its environmental persistence.
Brownspot ,How does this disease differ from other plant diseases?,It differs by causing lesions that directly affect grain quality.
Brownspot ,What is the role of farmers in managing this disease?,Farmers play a critical role by implementing proper management strategies.
Brownspot ,How quickly can this disease spread in a rice field?,It can spread rapidly under ideal conditions like high humidity and moderate temperatures.
Brownspot ,How does the agricultural industry monitor this disease?,Monitoring involves field inspections and fungal testing.
Brownspot ,What is the biggest challenge in managing this disease?,The biggest challenge is managing environmental factors and reducing fungal spread.
Brownspot ,What research is being done to combat this disease?,Research focuses on resistant varieties and advanced fungicides.
Brownspot ,What is the scientific name of the pathogen causing this disease?,The pathogen's scientific name is Bipolaris oryzae.
Brownspot ,How has this disease impacted global rice production?,It has significantly reduced rice yields in vulnerable regions.
Brownspot ,Are there regions where this disease is more common?,"It is more common in Asia, Africa, and Latin America."
Brownspot ,How do researchers identify this disease in the lab?,Researchers identify it through fungal cultures and molecular techniques.
Brownspot ,What are some success stories in controlling this disease?,Success stories include breeding resistant rice varieties.
Brownspot ,What symptoms indicate this disease in plants?,"Symptoms include brown, circular to oval lesions on leaves and seeds."
Brownspot ,How does this disease appear on rice crops?,It appears as dark brown spots with yellowish halos on leaves.
Brownspot ,What are the visible signs of this disease?,"Visible signs are brown lesions, seed discoloration, and poor plant vigor."
Brownspot ,What key symptoms should farmers monitor for this disease?,Farmers should monitor for brown spots on leaves early in the growing season.
Brownspot ,How early can symptoms of this disease be detected?,Symptoms can be detected in the early tillering stage.
Brownspot ,What distinguishes this disease's symptoms from others?,The spots have a characteristic dark center and light brown edges.
Brownspot ,Are there specific symptoms on the leaves caused by this disease?,"Yes, brown spot commonly causes lesions on leaves."
Brownspot ,How do symptoms of this disease progress over time?,Symptoms progress from small spots to extensive leaf damage.
Brownspot ,What are the initial signs of this disease in plants?,"Initial signs are tiny, dark brown spots on lower leaves."
Brownspot ,How can farmers differentiate this disease from similar ones?,Farmers can differentiate it by the shape and size of the lesions.
Brownspot ,"Does this disease cause discoloration? If so, how?","Yes, it causes discoloration, particularly on leaves and seeds."
Brownspot ,What physical changes occur in plants due to this disease?,Physical changes include weakened leaves and shriveled grains.
Brownspot ,Does this disease cause damage to plant roots or leaves?,It primarily damages leaves and seeds but not roots.
Brownspot ,What happens to rice plants in the advanced stages of this disease?,"In advanced stages, plants may dry out and die prematurely."
Brownspot ,Are there any specific growth stunts caused by this disease?,Growth stunts include reduced tillering and plant height.
Brownspot ,What happens to the grain quality when this disease occurs?,Grain quality decreases due to shriveling and discoloration.
Brownspot ,How visible are the symptoms of this disease during harvest?,Symptoms are visible on leaves and grains at harvest.
Brownspot ,Does this disease spread uniformly across the plant?,The disease often spreads unevenly across the plant.
Brownspot ,What happens to infected plants if untreated?,Untreated plants may have reduced yields and increased susceptibility to other diseases.
Brownspot ,Are the symptoms of this disease affected by environmental factors?,"Symptom severity is influenced by temperature, humidity, and soil conditions."
Brownspot ,How does this disease affect young rice plants differently than mature plants?,Young plants exhibit more leaf damage than mature plants.
Brownspot ,Are the symptoms more severe during specific growth stages?,"Yes, symptoms are more severe during tillering and grain-filling stages."
Brownspot ,Can this disease cause irreversible damage to rice plants?,It can cause irreversible damage if left untreated.
Brownspot ,What does this disease look like under a microscope?,"Under a microscope, fungal spores and hyphae can be seen."
Brownspot ,Do symptoms of this disease vary by rice variety?,Symptoms can vary in severity across different rice varieties.
Brownspot ,How do farmers typically identify symptoms in the field?,Farmers identify symptoms by inspecting leaves and seeds in the field.
Brownspot ,Does this disease affect only the leaves or other parts of the plant as well?,It primarily affects leaves but can also damage grains.
Brownspot ,What secondary infections can occur due to this disease?,Secondary infections like bacterial blight may occur.
Brownspot ,How can early symptoms of this disease be distinguished from nutrient deficiencies?,Lesions are darker and more defined than nutrient deficiency symptoms.
Brownspot ,Does this disease cause any unusual changes in plant behavior?,It may cause unusual stunted growth patterns.
Brownspot ,Are there visual signs on rice grains caused by this disease?,"Yes, infected grains often appear shriveled and discolored."
Brownspot ,How do symptoms progress in untreated cases of this disease?,"Symptoms worsen over time, leading to significant leaf damage."
Brownspot ,Are there subtle symptoms that might go unnoticed?,"Subtle symptoms include small, barely visible lesions in early stages."
Brownspot ,What happens to the root system in plants affected by this disease?,Root systems remain unaffected directly but may weaken due to plant stress.
Brownspot ,Does the disease cause structural changes to rice plants?,Structural changes include weakened leaf integrity.
Brownspot ,Can symptoms be detected with the naked eye?,"Yes, the disease can be detected with the naked eye in advanced stages."
Brownspot ,How do environmental conditions affect symptom severity?,Higher humidity increases symptom severity.
Brownspot ,Are the symptoms of this disease different in dry fields versus flooded fields?,Symptoms are generally worse in flooded fields due to higher humidity.
Brownspot ,Can modern tools like drones detect symptoms of this disease?,"Yes, drones equipped with sensors can detect symptoms."
Brownspot ,Are there patterns in how symptoms spread across the plant?,Symptoms spread from older to younger leaves.
Brownspot ,What causes this disease?,It is caused by the fungus Bipolaris oryzae.
Brownspot ,What are the primary triggers for this disease?,"Primary triggers include humidity, moderate temperatures, and poor nutrition."
Brownspot ,How does this disease originate in rice crops?,"It originates from infected seeds, residues, and environmental conditions."
Brownspot ,What environmental factors contribute to this disease?,Humidity and nutrient-poor soils contribute to its development.
Brownspot ,How is this disease introduced into fields?,"It is introduced via infected seeds, soil, or residue."
Brownspot ,What specific pathogens are responsible for this disease?,Bipolaris oryzae is the specific pathogen.
Brownspot ,How does the lifecycle of this disease begin?,The lifecycle begins with fungal spores germinating on plant surfaces.
Brownspot ,"Is this disease caused by bacteria, fungi, or viruses?",It is caused by a fungus.
Brownspot ,What human actions might lead to the development of this disease?,Over-irrigation and poor sanitation can lead to outbreaks.
Brownspot ,What climatic conditions allow this disease to thrive?,"Warm, humid climates are ideal for the disease."
Brownspot ,Does irrigation water play a role in spreading this disease?,Contaminated irrigation water can spread the fungus.
Brownspot ,How do soil conditions affect the occurrence of this disease?,Poor soil nutrition increases susceptibility.
Brownspot ,Is this disease caused by pests acting as vectors?,Pests may not directly cause it but can spread spores.
Brownspot ,Does this disease spread from plant to plant?,"Yes, it spreads from plant to plant via spores."
Brownspot ,Can wind or rain contribute to this disease?,Rain and wind can carry fungal spores.
Brownspot ,What role do insects play in transmitting this disease?,Insects can act as vectors for fungal spores.
Brownspot ,How do farmers unknowingly spread this disease?,Farmers may spread it through contaminated equipment.
Brownspot ,Is seed quality related to the occurrence of this disease?,Infected seeds are a common source of the disease.
Brownspot ,Are weeds in fields responsible for harboring this disease?,Weeds can harbor the pathogen and contribute to spread.
Brownspot ,What role does crop residue play in spreading this disease?,Residues of infected plants promote fungal survival.
Brownspot ,Are there genetic factors that make plants more susceptible to this disease?,Genetic susceptibility varies among rice varieties.
Brownspot ,Can weather alone trigger this disease?,Weather alone does not trigger it but influences its spread.
Brownspot ,Are certain pests responsible for spreading this disease?,Some pests can spread spores indirectly.
Brownspot ,How does poor field sanitation lead to this disease?,Poor sanitation allows spores to thrive.
Brownspot ,Can excessive fertilizer application cause this disease?,Over-fertilization may weaken plant resistance.
Brownspot ,Are there specific types of irrigation systems linked to this disease?,Flood irrigation systems can increase the risk.
Brownspot ,How does the pathogen causing this disease survive between seasons?,The fungus survives on residues between seasons.
Brownspot ,Does soil type influence the occurrence of this disease?,"Clay soils may retain more moisture, favoring the disease."
Brownspot ,Can this disease be introduced through infected seeds?,"Yes, infected seeds can introduce the fungus."
Brownspot ,Are there specific farming practices that contribute to this disease?,Practices like monocropping increase susceptibility.
Brownspot ,How do neighboring infected fields affect disease spread?,Spores from infected fields can spread via wind or water.
Brownspot ,Is this disease influenced by changes in climate patterns?,Changing climate patterns may expand the disease's range.
Brownspot ,Are high-altitude rice fields less prone to this disease?,High-altitude fields may be less prone due to cooler temperatures.
Brownspot ,How does organic farming impact the occurrence of this disease?,Organic farming can reduce risk by improving soil health.
Brownspot ,Does this disease have multiple causes or just one?,It has a single primary cause: Bipolaris oryzae.
Brownspot ,Can animals inadvertently spread this disease?,Animals may spread spores on their bodies.
Brownspot ,What part of the plant is first affected by the pathogen?,Leaves are typically affected first.
Brownspot ,Does this disease have a dormant phase during the year?,The fungus can remain dormant during unfavorable conditions.
Brownspot ,How does human activity accelerate the spread of this disease?,Human activities like residue burning may accelerate spread.
Brownspot ,Are there unknown factors contributing to this disease?,Unknown environmental interactions may contribute.
Brownspot ,How does this disease affect crop yield?,Yield losses range from 10% to 50% in severe cases.
Brownspot ,What impact does this disease have on productivity?,Productivity declines due to reduced photosynthesis and grain quality.
Brownspot ,How much yield loss is typically caused by this disease?,Typical yield loss is 10-30% under moderate infections.
Brownspot ,What happens to harvests if this disease is left untreated?,Harvests shrink in volume and quality when untreated.
Brownspot ,Does this disease affect both quantity and quality of the yield?,Both yield quantity and grain quality are affected.
Brownspot ,Can this disease lead to complete crop failure?,Severe cases can cause complete crop failure.
Brownspot ,How does this disease affect grain development in rice?,"Grain development is impaired, leading to low-quality harvests."
Brownspot ,Does this disease reduce the size of harvestable grains?,Harvestable grains may be smaller and less dense.
Brownspot ,How does the infection rate correlate with yield loss?,Higher infection rates correlate with greater yield losses.
