disease,question,answer
Bacterialblight,How can early symptoms of this disease be distinguished from nutrient deficiencies?,Early symptoms differ from nutrient deficiencies in their water-soaked appearance.
Bacterialblight,Does this disease cause any unusual changes in plant behavior?,"Yes, it causes unusual wilting and necrosis patterns not seen in healthy plants."
Bacterialblight,Are there visual signs on rice grains caused by this disease?,"Rarely, but in severe cases, discoloration may appear on grains."
Bacterialblight,How do symptoms progress in untreated cases of this disease?,Symptoms progress to widespread necrosis and plant death if untreated.
Bacterialblight,Are there subtle symptoms that might go unnoticed?,"Yes, subtle symptoms like small streaks might go unnoticed early."
Bacterialblight,What happens to the root system in plants affected by this disease?,The root system is generally unaffected directly by the disease.
Bacterialblight,Does the disease cause structural changes to rice plants?,Structural changes include weakened stems and brittle leaves.
Bacterialblight,Can symptoms be detected with the naked eye?,"Yes, symptoms are easily detectable with proper training."
Bacterialblight,How do environmental conditions affect symptom severity?,High humidity and warm temperatures exacerbate symptoms.
Bacterialblight,Are the symptoms of this disease different in dry fields versus flooded fields?,Symptoms are more severe in flooded fields than in dry fields.
Bacterialblight,Can modern tools like drones detect symptoms of this disease?,"Yes, drones with imaging tools can detect symptoms early."
Bacterialblight,Are there patterns in how symptoms spread across the plant?,Symptoms spread upward and outward from the initial infection site.
Bacterialblight,What causes this disease?,It is caused by the bacterium Xanthomonas oryzae pv. oryzae.
Bacterialblight,What are the primary triggers for this disease?,"Primary triggers include high humidity, warm temperatures, and infected seeds."
Bacterialblight,How does this disease originate in rice crops?,"It originates from infected seeds, residue, or water."
Bacterialblight,What environmental factors contribute to this disease?,High humidity and poor field drainage contribute significantly.
Bacterialblight,How is this disease introduced into fields?,The disease is introduced through infected seeds or irrigation water.
Bacterialblight,What specific pathogens are responsible for this disease?,Xanthomonas oryzae pv. oryzae is the specific pathogen responsible.
Bacterialblight,How does the lifecycle of this disease begin?,The lifecycle begins when bacteria enter plant tissues through wounds or stomata.
Bacterialblight,"Is this disease caused by bacteria, fungi, or viruses?","It is caused by bacteria, specifically Xanthomonas species."
Bacterialblight,What human actions might lead to the development of this disease?,"Over-irrigation, infected seeds, and poor sanitation can lead to its development."
Bacterialblight,What climatic conditions allow this disease to thrive?,"Warm, wet climates are ideal for the bacterium to thrive."
Bacterialblight,Does irrigation water play a role in spreading this disease?,"Yes, irrigation water can spread bacterial blight."
Bacterialblight,How do soil conditions affect the occurrence of this disease?,"Poor soil conditions, especially waterlogging, increase its prevalence."
Bacterialblight,Is this disease caused by pests acting as vectors?,Pests do not directly cause the disease but may create entry points.
Bacterialblight,Does this disease spread from plant to plant?,"Yes, it spreads from plant to plant through water, wind, and tools."
Bacterialblight,Can wind or rain contribute to this disease?,Wind and rain can carry bacteria across fields.
Bacterialblight,What role do insects play in transmitting this disease?,Insects like leafhoppers can aid in bacterial transmission indirectly.
Bacterialblight,How do farmers unknowingly spread this disease?,Farmers spread it unknowingly by reusing infected tools and seeds.
Bacterialblight,Is seed quality related to the occurrence of this disease?,Low-quality seeds from infected plants often harbor the disease.
Bacterialblight,Are weeds in fields responsible for harboring this disease?,"Yes, weeds can harbor the bacterium, acting as a reservoir."
Bacterialblight,What role does crop residue play in spreading this disease?,Crop residue provides a breeding ground for bacteria between seasons.
Bacterialblight,Are there genetic factors that make plants more susceptible to this disease?,Susceptible genetics in rice varieties increase disease incidence.
Bacterialblight,Can weather alone trigger this disease?,"Weather, especially excessive humidity, can trigger the disease."
Bacterialblight,Are certain pests responsible for spreading this disease?,"No pests directly spread this disease, but they exacerbate infection risks."
Bacterialblight,How does poor field sanitation lead to this disease?,Poor field sanitation creates ideal conditions for bacterial growth.
Bacterialblight,Can excessive fertilizer application cause this disease?,Excessive nitrogen fertilizer use can exacerbate symptoms.
Bacterialblight,Are there specific types of irrigation systems linked to this disease?,Flood irrigation systems can spread the bacterium.
Bacterialblight,How does the pathogen causing this disease survive between seasons?,"The bacterium survives in plant debris, soil, and water between seasons."
Bacterialblight,Does soil type influence the occurrence of this disease?,Poorly drained or waterlogged soils favor bacterial growth.
Bacterialblight,Can this disease be introduced through infected seeds?,"Yes, infected seeds are a major source of initial infection."
Bacterialblight,Are there specific farming practices that contribute to this disease?,Practices like over-irrigation and poor drainage contribute to disease spread.
Bacterialblight,How do neighboring infected fields affect disease spread?,Neighboring infected fields spread bacteria through water runoff and wind.
Bacterialblight,Is this disease influenced by changes in climate patterns?,Climate change increases risks due to more frequent humid and warm conditions.
Bacterialblight,Are high-altitude rice fields less prone to this disease?,High-altitude fields are generally less prone due to cooler climates.
Bacterialblight,How does organic farming impact the occurrence of this disease?,Organic farming reduces some risk factors but does not guarantee prevention.
Bacterialblight,Does this disease have multiple causes or just one?,It has one primary cause: Xanthomonas oryzae pv. oryzae.
Bacterialblight,Can animals inadvertently spread this disease?,Animals can spread bacteria indirectly through contaminated fur or hooves.
Bacterialblight,What part of the plant is first affected by the pathogen?,"The bacterium first affects leaf tissues, entering through wounds or stomata."
Bacterialblight,Does this disease have a dormant phase during the year?,The bacterium can remain dormant in plant debris during dry conditions.
Bacterialblight,How does human activity accelerate the spread of this disease?,"Over-irrigation, monocropping, and poor sanitation accelerate spread."
Bacterialblight,Are there unknown factors contributing to this disease?,Unknown environmental interactions may still contribute to outbreaks.
Bacterialblight,How does this disease affect crop yield?,Yield reductions range from 20% to total crop loss in severe cases.
Bacterialblight,What impact does this disease have on productivity?,The disease decreases productivity by reducing photosynthesis and grain filling.
Bacterialblight,How much yield loss is typically caused by this disease?,"Typical yield loss is between 10–50%, depending on severity."
Bacterialblight,What happens to harvests if this disease is left untreated?,Untreated infections result in low-quality and reduced quantity of harvest.
Bacterialblight,Does this disease affect both quantity and quality of the yield?,"Yes, it reduces both the yield quantity and quality."
Bacterialblight,Can this disease lead to complete crop failure?,Severe outbreaks can lead to total crop failure.
Bacterialblight,How does this disease affect grain development in rice?,Grain development is hindered due to poor nutrient transport.
Bacterialblight,Does this disease reduce the size of harvestable grains?,"Grains are smaller, malformed, and less mature."
Bacterialblight,How does the infection rate correlate with yield loss?,Higher infection rates directly correlate with greater yield losses.
Bacterialblight,What economic impact does this disease have on farmers?,Farmers face financial losses due to reduced yield and increased treatment costs.
Bacterialblight,How does this disease affect the nutritional value of crops?,The nutritional value of affected crops is reduced due to poor grain development.
Bacterialblight,Are there visible differences in affected and unaffected crops?,"Affected crops appear stunted, with yellowed and necrotic leaves."
Bacterialblight,How does this disease impact the market value of rice?,Market value declines due to lower yield and poor-quality grains.
Bacterialblight,Does this disease lead to uneven growth in rice fields?,Uneven growth and patchy fields are common in severely infected areas.
Bacterialblight,What are the long-term impacts on fields with frequent disease outbreaks?,Long-term outbreaks reduce soil fertility and increase farming costs.
Bacterialblight,How does this disease interact with other stress factors on plants?,"Other stresses, like pests or drought, worsen the disease's impact."
Bacterialblight,Is the loss caused by this disease uniform across all rice varieties?,Loss severity varies depending on the rice variety and its resistance level.
Bacterialblight,What role does early detection play in reducing yield loss?,Early detection minimizes yield losses through timely intervention.
Bacterialblight,How does this disease affect the milling quality of rice grains?,Milling quality is reduced as grains are poorly developed.
Bacterialblight,Can this disease lead to replanting costs for farmers?,Replanting costs increase when young plants die due to infection.
Bacterialblight,Does this disease always lead to yield losses?,Yield losses are not always guaranteed but are likely under severe infection.
Bacterialblight,What is the average yield loss caused by this disease worldwide?,"Global yield losses average around 10–30%, depending on management."
Bacterialblight,Are organic farms more or less affected by this disease?,Organic farms are less affected if resistant varieties and sanitation are prioritized.
Bacterialblight,How does the disease affect grain size and weight?,Grains from infected plants are smaller and lighter in weight.
Bacterialblight,Are infected crops more likely to attract pests?,"Yes, weakened plants attract secondary pests."
Bacterialblight,Does this disease reduce the nutritional value of the rice produced?,Nutritional value diminishes as grains are poorly developed.
Bacterialblight,How does this disease affect the appearance of rice grains?,Grains from affected plants may appear shriveled and discolored.
Bacterialblight,Are there studies quantifying the economic impact of this disease?,Studies estimate billions of dollars in economic losses annually.
Bacterialblight,How much time does it take for yield losses to become noticeable?,Yield losses become evident within weeks of severe infection.
Bacterialblight,Are there indirect impacts on productivity caused by this disease?,Indirect impacts include increased pest activity and reduced soil health.
Bacterialblight,Can infected plants still produce viable seeds?,"Infected plants may still produce seeds, but their quality is compromised."
Bacterialblight,How does this disease affect overall field uniformity?,"Fields appear uneven, with patches of stunted, necrotic plants."
Bacterialblight,What percentage of the field is typically affected in severe cases?,Severe cases can affect 50–80% of the field.
Bacterialblight,Are yield losses from this disease consistent across regions?,"Losses vary by region, field conditions, and rice variety."
Bacterialblight,How does delayed treatment increase yield losses?,Delayed treatment leads to more widespread and severe yield losses.
Bacterialblight,Can modern farming technology mitigate yield losses?,Modern tools like drones and automated sprayers can reduce losses.
Bacterialblight,Are there long-term soil effects from this disease?,Long-term effects include reduced soil fertility and recurring outbreaks.
Bacterialblight,Can this disease cause farmers to abandon fields entirely?,Farmers may abandon severely infected fields due to economic losses.
Bacterialblight,Are export-quality rice grains impacted more by this disease?,Export-quality grains suffer more as strict standards are unmet.
Bacterialblight,How does this disease affect farmer incomes directly?,Direct income losses arise from reduced yield and poor-quality harvests.
Bacterialblight,How can this disease be prevented?,"Prevention involves resistant varieties, sanitation, and water management."
Bacterialblight,What are effective prevention strategies for this disease?,Effective strategies include using resistant seeds and proper field sanitation.
Bacterialblight,What can farmers do to reduce the risk of this disease?,"Farmers should practice crop rotation, monitor fields, and remove infected debris."
Bacterialblight,How should fields be prepared to prevent this disease?,Fields should be well-drained and free of infected residue before planting.
Bacterialblight,What preventive measures can be taken during the planting season?,"During planting, use treated seeds and avoid overcrowding."
Bacterialblight,Are there any resistant varieties to this disease?,"Yes, some resistant varieties are available, such as IR64."
Bacterialblight,What role does crop rotation play in preventing this disease?,"Crop rotation disrupts the bacterium's lifecycle, reducing disease risk."
Bacterialblight,How does water management help prevent this disease?,Proper water management prevents bacterial spread in fields.
Bacterialblight,Can the use of fertilizers prevent this disease?,Balanced fertilizer application reduces susceptibility to infection.
Bacterialblight,What role does field sanitation play in disease prevention?,"Field sanitation, such as removing plant debris, is essential."
Bacterialblight,Should farmers remove infected plants to prevent spread?,"Yes, removing infected plants prevents further spread."
Bacterialblight,Are there any biological controls for this disease?,Biological controls like antagonistic bacteria are under research.
Bacterialblight,How does avoiding overcrowding help prevent this disease?,Overcrowding increases humidity and should be avoided.
Bacterialblight,What should farmers avoid doing to prevent this disease?,Farmers should avoid over-irrigation and improper drainage practices.
Bacterialblight,Can monitoring weather forecasts help in disease prevention?,Monitoring weather forecasts helps prepare for favorable conditions.
Bacterialblight,Are there specific tools for detecting this disease early?,Drones and imaging tools can detect early symptoms effectively.
Bacterialblight,How do seed treatments help prevent this disease?,Treated seeds reduce the risk of initial infection.
Bacterialblight,What role does pest control play in preventing this disease?,Pest control prevents secondary infections and physical entry points.
Bacterialblight,Are there government recommendations for disease prevention?,Governments recommend resistant varieties and improved irrigation systems.
Bacterialblight,How does maintaining healthy soil help avoid this disease?,Healthy soils promote plant resistance and reduce infection risk.
Bacterialblight,What advanced techniques are available to prevent this disease?,Advanced techniques like genome editing can enhance resistance.
Bacterialblight,Can using specific fertilizers reduce the risk of this disease?,Proper fertilizer use strengthens plant defenses against bacteria.
Bacterialblight,How does proper drainage help prevent this disease?,Good drainage prevents waterlogging and bacterial spread.
Bacterialblight,Are there natural ways to prevent this disease without chemicals?,Natural practices include crop rotation and debris removal.
Bacterialblight,Does planting resistant rice varieties guarantee prevention?,"Resistant varieties reduce, but do not eliminate, infection risk."
Bacterialblight,Can weather prediction tools help in disease prevention?,Weather tools help predict and mitigate high-risk periods.
Bacterialblight,How often should fields be inspected to prevent this disease?,Weekly inspections during high-risk seasons are recommended.
Bacterialblight,Are there community-level prevention strategies for this disease?,Community-level measures include shared knowledge and coordinated practices.
Bacterialblight,Can crop diversification help in prevention efforts?,Crop diversification disrupts bacterial spread and reduces risks.
Bacterialblight,How does seed quality testing help in prevention?,Testing ensures seeds are disease-free before planting.
Bacterialblight,Are there apps or tools for monitoring prevention measures?,Apps help monitor field conditions and recommend preventive actions.
Bacterialblight,Can companion planting help prevent this disease?,Companion planting is less effective for bacterial blight.
Bacterialblight,How do cover crops reduce the occurrence of this disease?,Cover crops improve soil health and reduce bacterial reservoirs.
Bacterialblight,Is it necessary to avoid planting in infected fields for several seasons?,Avoiding infected fields for multiple seasons reduces recurrence.
Bacterialblight,Are there any global campaigns for disease prevention?,Global campaigns promote resistant varieties and awareness.
Bacterialblight,How does soil testing assist in preventing this disease?,Soil testing identifies high-risk areas for bacterial growth.
Bacterialblight,What is the role of agricultural extension services in prevention?,Extension services educate farmers about best practices.
Bacterialblight,How can farmers educate themselves about prevention?,Farmers can attend workshops and access online resources.
Bacterialblight,Are there any grants available for disease prevention efforts?,Grants are available for research and implementation of preventive measures.
Bacterialblight,What are the most cost-effective prevention strategies?,Cost-effective strategies include resistant seeds and proper drainage.
Bacterialblight,What treatments are available for this disease?,Treatments include bactericides and resistant variety adoption.
Bacterialblight,How can this disease be treated effectively?,"Effective treatment involves sanitation, timely bactericide application, and monitoring."
Bacterialblight,What chemical controls are recommended for this disease?,Copper-based bactericides are commonly recommended.
Bacterialblight,Can this disease be treated organically?,Organic methods like antagonistic bacteria are under development.
Bacterialblight,Are there specific fungicides or bactericides for this disease?,Copper-based bactericides effectively control bacterial blight.
Bacterialblight,How should infected plants be handled during treatment?,Infected plants should be removed and destroyed to limit spread.
Bacterialblight,What role does pruning play in treating this disease?,Pruning infected leaves reduces bacterial load in the field.
Bacterialblight,Can this disease be managed with biological methods?,Biological methods like phage therapy are being explored.
Bacterialblight,How frequently should treatments be applied for this disease?,Treatments are usually applied every 10–14 days during active outbreaks.
Bacterialblight,Are there any risks associated with treating this disease?,Overuse of bactericides may lead to resistance development.
Bacterialblight,Can infected fields be salvaged during harvest?,Infected fields can be salvaged if treated early.
Bacterialblight,What is the best time to apply treatments for this disease?,Treatments are most effective during early symptom stages.
Bacterialblight,How do weather conditions affect treatment success?,"Rain reduces treatment effectiveness, requiring reapplication."
Bacterialblight,Should farmers mix treatments for this disease with fertilizers?,Treatments should not be mixed with fertilizers unless recommended.
Bacterialblight,How do irrigation practices change during treatment?,Irrigation should be adjusted to reduce bacterial spread during treatment.
Bacterialblight,Are there field practices that complement chemical treatments?,Practices like debris removal and reduced humidity complement treatments.
Bacterialblight,Can this disease be treated after symptoms appear?,"Yes, early treatment can limit symptoms and losses."
Bacterialblight,How do resistant varieties support treatment efforts?,Resistant varieties reduce the need for chemical treatments.
Bacterialblight,Should infected plant debris be removed immediately?,"Yes, removing infected debris prevents re-infection."
Bacterialblight,Are there government-approved protocols for treating this disease?,Governments provide protocols for managing bacterial outbreaks.
Bacterialblight,What are some alternative treatments for this disease?,Alternative treatments include neem extracts and microbial antagonists.
Bacterialblight,How do biological treatments compare to chemical ones?,Biological methods are eco-friendly but slower than chemicals.
Bacterialblight,Can infected plants fully recover with proper treatment?,"Recovery is possible if treated early, though yield may still decrease."
Bacterialblight,Are there eco-friendly treatment options available?,Eco-friendly options include organic bactericides and cultural practices.
Bacterialblight,How long does treatment take to show results?,Results may take 1–2 weeks to become visible.
Bacterialblight,Should infected plants be removed immediately during treatment?,"Yes, removing infected plants during treatment is essential."
Bacterialblight,Are there any traditional remedies for this disease?,Traditional remedies like ash and lime have limited efficacy.
Bacterialblight,Can this disease be controlled with mixed treatments?,Mixed treatments can improve effectiveness but must be tested.
Bacterialblight,How do farmers know if a treatment is effective?,Treatment success is observed through reduced symptom progression.
Bacterialblight,Should treatments be repeated if symptoms persist?,Reapply treatments as needed to prevent recurrence.
Bacterialblight,Can drones or smart technology help apply treatments?,Drones ensure even and efficient treatment application.
Bacterialblight,Are treatment costs sustainable for small-scale farmers?,Costs can be high for small farmers without subsidies.
Bacterialblight,What mistakes should be avoided during treatment?,Avoid overusing chemicals to prevent resistance.
Bacterialblight,Are there any post-treatment measures to prevent recurrence?,Post-treatment measures include debris removal and sanitation.
Bacterialblight,How does the timing of treatment affect its success?,Timely treatment minimizes bacterial spread and symptom severity.
Bacterialblight,Are there any side effects of using chemicals for treatment?,Overuse of chemicals can harm soil health and beneficial microbes.
Bacterialblight,How do weather conditions influence treatment application?,High humidity after treatment may reduce its effectiveness.
Bacterialblight,Can treatment also protect neighboring fields?,Neighboring fields can be protected with border treatments.
Bacterialblight,Are combination treatments more effective for this disease?,Combination treatments are effective but require careful application.
Bacterialblight,What are the best practices for treating large-scale outbreaks?,Large-scale outbreaks require community coordination and government support.
Bacterialblight,When does this disease typically develop?,"It develops during warm, humid weather, often in the growing season."
Bacterialblight,During which seasons is this disease most common?,It is most common during the rainy season.
Bacterialblight,What weather conditions favor this disease?,"Warm, humid conditions favor bacterial blight development."
Bacterialblight,Does this disease develop faster in certain climates?,It spreads faster in tropical climates with consistent humidity.
Bacterialblight,How do temperature changes affect this disease?,Higher temperatures accelerate bacterial multiplication.
Bacterialblight,What role does humidity play in the spread of this disease?,High humidity allows bacteria to thrive and spread.
Bacterialblight,Are rainy seasons associated with outbreaks of this disease?,Rainy seasons create ideal conditions for bacterial spread.
Bacterialblight,How quickly does this disease spread in ideal conditions?,"Under ideal conditions, it can spread across a field within weeks."
Bacterialblight,What time of year is best for preventing this disease?,Dry seasons with low humidity are best for prevention.
Bacterialblight,How does soil moisture impact the occurrence of this disease?,High soil moisture promotes bacterial spread and infection.
Bacterialblight,Are drought conditions linked to this disease?,"Drought reduces spread but weakens plants, making them susceptible later."
Bacterialblight,Does wind speed affect the spread of this disease?,Wind spreads bacteria across neighboring plants.
Bacterialblight,How do prolonged wet conditions contribute to this disease?,Prolonged wet conditions increase infection rates significantly.
Bacterialblight,What time of day is best for monitoring this disease?,"Early morning is ideal for monitoring, as dew reveals symptoms."
Bacterialblight,Can cool nights and warm days promote this disease?,Warm days and cool nights accelerate disease development.
